,Company/Candidate Name,Role,Sub-skill,Count
158,Confidential,Regional Application Specialist -South East Asia--IVD industry,"presentation, communication, communication skills, ms office",4
159,Confluence,Associate Client Consultant,"client, excel, problem solving, communication, analytical skills, organized, flexible",9
160,Connexant Company Limited,Content Creator,"marketing, digital, content marketing, strategies, seo, optimization, data analysis, data driven, english, communication, communication skills, articulation, writing skills",28
161,Consea Group,Technical Sales Manager,"client, marketing, communication, english, problem solving, organizational, flexible",9
162,Contego - Global Talent Solutions,"Director of Procurement Alco, drinks experience (candidates ideally based in Vietnam as relocation may not be offered) Reloation","client, marketing, strategies, optimization, supply chain, data analysis",10
163,Crypto.com,(Senior) Mobile Developer - iOS,"swift, c, ui, problem solving, communication, digital",7
164,Cushman & Wakefield,Intern,"databases, market research, client, excel, powerpoint, english, problem solving, time management, communication, communication skills, flexible, go",12
165,DDS Petro Group,Finance Analyst,"supply chain, strategic planning, organizational, communication, presentation, financial analysis",6
166,DHL Supply Chain,Business Development Manager,"supply chain, market research, client, business development, communication, interpersonal skills, organizational, problem solving, english",12
167,DHL Supply Chain,Management Trainee Program,"supply chain, communication, presentation, ownership, go, problem solving, english",10
168,DJRecruit Asia,"Head of Sales- Aesthetics Industry  - Up to US$7,000 per month (Ho Chi Minh City, Vietnam)","client, strategies, marketing, market research, sales management, leadership, team management, communication, problem solving, vietnamese, english",16
169,DJRecruit Asia,"Manager/ Principal/ Senior Consultants - DJRecruit Recruitment Sales (Circa US$1,500 - US$3,500 + Commission + Override)","marketing, c, leadership, client, communication, communication skills, english, vietnamese, databases, business development",11
170,DKSH,*Accounting Intern,"marketing, flexible",2
171,DKSH,*Assistant Manager Finance,"performance management, optimization, financial analysis, communication, flexible",5
172,DKSH,*Digital Marketing Intern,"marketing, digital, market research, flexible",5
173,DKSH,*Ecommerce Tiktok Content Intern,"marketing, flexible",2
174,DKSH,*Manager General Lab & Distributions (Dealers Management),"marketing, communication, communication skills, flexible",4
175,DKSH,*Manager Technical Sales (FDI Marine and Oil & Gas Engines),project management,2
176,DKSH,"*Manager, Application Engineering & Project Management (CumminsDKSH Vietnam)","marketing, project management, product design, english, communication, interpersonal skills, leadership, team management, adaptability, problem solving, flexible",12
177,DKSH,"*Manager, Hospital Sourcing Management","strategies, communication, communication skills, english, excel, powerpoint, flexible",7
178,DKSH,"*Manager, Product Management","marketing, strategies, documentation, client, client management, communication, project management, statistical analysis, english, excel, powerpoint, flexible",13
179,DKSH,"*Sale Manager, Cosmetics (Pharmacy Channel)","strategies, client, communication, excel, powerpoint, english",6
180,DKSH,Executive Key Account Management,"customer relationship management, supply chain, marketing, english, flexible",7
181,DKSH,Product Specialist (Aesthetic),"data reporting, customer relationship management, databases, flexible",4
182,DKSH,Senior Manager Treasury,"english, flexible",2
183,DP World,Accounts Payable Officer,supply chain,2
184,DP World,Junior Sales Executive,"english, supply chain, communication, communication skills, industry knowledge, lead generation, marketing",12
185,DP World,Sales Manager – Vietnam (Ho Chi Minh City),"client, strategies, business development, english, interpersonal skills, supply chain",7
186,DP World,"Senior Manager/Director of Freight Forwarding Business Process, Southeast Asia (Based in Vietnam)","supply chain, documentation, project management, communication, communication skills, adaptability",8
187,DXC Technology Vietnam,Solution Architect,"initiative, optimization, business strategy",4
188,DYM VIETNAM COMPANY LIMITED,Application Developer,"advertising, react, flutter, php, wordpress, problem solving, communication, web apps, agile methodologies, leadership",11
189,DYM VIETNAM COMPANY LIMITED,Senior Accountant,"english, leadership, problem solving, communication, interpersonal skills",5
190,DYM VIETNAM COMPANY LIMITED,Web Designer,"ui, ux, communication, css, javascript, go",11
191,Dai-ichi Life Vietnam,Actuarial Assistant Manager (Pricing team),"market research, english, communication",3
192,Dai-ichi Life Vietnam,Product Development Staff - 12 months,english,1
193,Dai-ichi Life Vietnam,Tax Senior Specialist,"strategies, documentation, communication, communication skills, excel",6
194,Danone,SEA Senior Legal & Compliance Manager,"strategies, communication",3
195,Deloitte,Consultant - Organization Transformation - VN,"business strategy, presentation, client, client management, organizational, problem solving, leadership, communication, communication skills",11
196,Deloitte,Graduate Analyst - Oracle (Finance) - Vietnam (July 2024 Intake),"excel, team work, data analysis, resource planning, performance management, supply chain, analytical skills, communication, communication skills, english, problem solving, client, leadership",14
197,Deloitte,Graduate Analyst - Strategy & Business Design - Vietnam (July 2024 Intake),"client, project management, initiative, communication, communication skills, creative, interpersonal skills",8
198,Deloitte,Senior Consultant - SAP SD (Sales and Distribution) - VN,"excel, team work, client, communication, presentation, english, leadership",8
199,Deloitte,Specialist - Talent Acquisition - ID/TH/MY/PH,"excel, team work, strategies, communication, digital, interpersonal skills",6
200,Dentons LuatViet,Legal Associate,"vietnamese, client, strategies, problem solving, communication, communication skills, english, excel",10
201,Dentsu Creative,PR Manager,"leadership, client, data analysis, data driven, strategies, market research, marketing, communication, communication skills, excel",18
202,Dentsu Sports Vietnam,Accountant & Admin,"organizational, english, ms office",4
203,Destination Asia,MICE Specialist,"client, creative, marketing",8
204,Dextra Transport,Country Manager,"business development, communication, leadership, english, vietnamese",5
205,Dezan Shira & Associates,"Business Intelligence, Associate","business intelligence, market research, databases, marketing, business development, communication, english, vietnamese, excel, powerpoint, communication skills",22
206,Diag Medical,Legal and Compliance Manager,"strategies, problem solving, communication, negotiation skills, english, vietnamese, project management",7
207,Diag Medical,Outbound Sales Specialist,"adaptability, ms office, english",3
208,Diana Unicharm JSC,[HCM] Senior Area Sales Manager/Senior ASM – GT Channel (In charge Provinces),"strategies, direct sales, leadership, marketing, ms word, excel, powerpoint, english",9
209,Digiworld Corporation,Account Manager (ICT Product),"marketing, communication, communication skills, english, data analysis, business development",9
210,Digiworld Corporation,Human Resources Business Partner (Sales),"organizational, communication, data analysis, communication skills, presentation, english, vietnamese",10
211,Disney Experiences,"Assistant Manager, New Business Development and Key Account Management, Vietnam","business development, strategies, organizational, marketing, financial analysis, leadership, vietnamese, problem solving, business insights, communication, presentation, flexible",21
212,DisplaySweet,Senior Architectural Visualizer,"presentation, python, leadership, english",4
213,E-Study School,Chief Accountant,"leadership, strategic planning, vietnamese, team management, problem solving, english",7
214,EMVN Music Licensing,Junior Sales Representative,"vietnamese, lead generation, business development, marketing, communication, presentation, english, flexible, team building",11
215,EQuest Education Group,"Assistant to Vice President, Finance","financial analysis, communication, multitask, english",5
216,EQuest Education Group,ESH - Secondary  Coordinator,"leadership, team work, communication, c",8
217,EQuest Education Group,[Sedbergh Vietnam] Senior Digital Marketing Executive,"digital, digital marketing, marketing, strategies, data driven, email marketing, vietnamese, english, social media marketing, optimization",27
218,EQuest Education Group,[iSMART HCM] ESL TEACHER,"english, communication",3
219,EVEROK GROUP,Customer Service ( Freight Forwarding),"english, initiative, communication, team work",4
220,EVEROK GROUP,Team Leader( Freight Forwarding),"documentation, team management, problem solving, business development, english",6
221,EY,(Senior) Manager | HR Consulting (Total Rewards Advisory) | HCMC Office,"creative, business strategy, strategies, digital, optimization, organizational, client, business development, leadership, problem solving, excel, people management",25
222,EY,Legal Counsel | HCMC Office,"english, communication, presentation, leadership",4
223,EY,Senior Associate | Chinese-desk Business Development | HCMC Office,"c, leadership, communication, marketing, english, creative",6
224,EY,Technology Consulting - Cyber Security (Manager/ Senior Manager),"business strategy, growth strategy, client, marketing, leadership, penetration testing, industry knowledge, big data, problem solving, excel, communication, communication skills, people management, flexible",23
225,Edelman,Client Manager,"client, marketing, writing skills, digital, advertising, strategies",18
226,Edelman,PR Intern (Full-time),"communication, vietnamese, english, strategies, advertising, digital",7
227,Edelman,Senior Client Executive,"client, marketing, advertising, initiative, strategies, digital",14
228,Elanco,Senior Finance Manager,"organizational, business development, leadership, supply chain, analytical skills, communication, communication skills, strategic planning, problem solving, adaptability, interpersonal skills",13
229,Element6 Technologies,Mobile Game Designer,"documentation, ownership, team work, ui, ux, creative, english, communication, communication skills, marketing, market research",11
230,Element6 Technologies,Mobile Game Marketing Specialist,"strategies, marketing, creative, advertising, data analysis, performance metrics, problem solving, communication",14
231,Entravision APAC,Client Partner - Pinterest,"advertising, client, marketing, communication, digital, creative",11
232,Entravision Vietnam,Client Partner,"client, digital, marketing, leadership, digital marketing, communication, presentation, english, vietnamese",18
233,Evonik,Finance and Accounting Manager,"flexible, r, documentation, problem solving, communication, communication skills, interpersonal skills, initiative, english",12
234,Evoto AI,Sales Manager,"communication, negotiation skills",2
235,Excis Compliance,Information Technology Support Engineer,"communication, ms office, encryption, problem solving, flexible",6
236,Exclusive Networks,Product Manager,"digital, marketing, c, communication, interpersonal skills, initiative, server, people focused",14
237,FE CREDIT,"Database Administrator Expert (SQL Server, PostgreSQL)","etl, databases, optimization, sql, documentation, aws, python, data warehousing, data modeling, azure, problem solving, communication, interpersonal skills",31
238,FE CREDIT,Financial Analyst Expert/Senior Specialist,"business plan, optimization, business analysis, sql",5
239,FE CREDIT,Information Risk Management Expert,"communication, ms office, excel, powerpoint, english, conflict resolution",7
240,FE CREDIT,Partnership Center Director (B2B2C),"direct sales, market research, business development, marketing, leadership, strategic thinking, communication, project management, english",13
241,FE CREDIT,Sales System & Process Enhancement Management Specialist,"business analysis, vietnamese, english, powerpoint, presentation, communication",6
242,FE CREDIT,Senior Foreign Financial Institutions Relationship Specialist,"communication, vietnamese",2
243,FE CREDIT,Senior IT Business Analyst Specialist,"go, business analysis, databases, sdlc, critical thinking, communication, communication skills, vietnamese, english, ownership",11
244,FE CREDIT,Senior Quality Control Specialist,"business analysis, sql, api, flexible, jenkins, aws",6
245,Faraday,HR Business Partner,"strategies, performance management, vietnamese, data analysis, communication, problem solving, excel, powerpoint, english",11
246,Ferring Pharmaceuticals,HR & Admin Assistant,"inventory management, communication, communication skills, english, organizational, time management, ms office",8
247,Fersol (ex-Brunel Russia),Deputy COO,"client, marketing, supply chain, business development, english",7
248,Festo,General Accountant (Temporary 9 months),"excel, communication, problem solving",3
249,"FinT Vietnam, Inc.",Content Creator Intern,"influencer marketing, marketing, market research, english, creative",7
250,Fluke Corporation,Product Marketing Manager (Vietnam),"marketing, go, creative, communication, presentation, time management, organizational, product design, data driven",17
251,Fonterra,Marketing Director (Vietnam and Cambodia),"marketing, market research, leadership, digital, brand management, people management, initiative, digital marketing, analytical skills, communication, communication skills, vietnamese, english",31
252,Formative Search,Project Manager (Onshore Wind) - Vietnam,"strategies, project management, vietnamese, english",6
253,Forvis Mazars in Vietnam,Senior Accountant,"ui, client, communication, ms excel, excel, english",6
254,Forvis Mazars in Vietnam,Tax Intern,"english, writing skills, vietnamese",4
255,Forvis Mazars in Vietnam,Tax Manager,"team leader, business development, english, vietnamese, time management",7
256,Four Hands Vietnam,BI Supervisor,"dashboards, initiative, data modeling, creative, problem solving, communication, communication skills, english, adaptability, sql, supply chain",12
257,Four Hands Vietnam,Senior Azure Engineer,"azure, devops, problem solving, documentation, agile methodologies, english, communication",11
258,Francia Beauty Group,Media Lead,"strategies, marketing, digital, digital marketing, communication, performance metrics, advertising, organized, optimization",15
259,Fulbright University Vietnam,Director Undergraduate of Admissions And Financial Aid,"vietnamese, creative, leadership, marketing, digital, strategies, business development, problem solving, communication, communication skills, strategic planning, english, flexible",21
260,Funding Societies | Modalku Group,Vietnam COO/ Operating Director (Fintech/ Banking/ SME lending),"digital, organizational, marketing, performance management, strategies, c, english, vietnamese, leadership, communication, presentation, problem solving, flexible",14
261,GENUINE PARTNER GROUP,Deputy Director of Operations,"marketing, strategies, english, communication, communication skills",8
262,GENUINE PARTNER GROUP,Deputy Director of Transport Engineering,"communication, communication skills, creative",3
263,GENUINE PARTNER GROUP,Legal Specialist,"english, communication, vietnamese, problem solving, communication skills, negotiation skills, conflict resolution",8
264,GENUINE PARTNER GROUP,Recruitment Executive,"strategies, communication, interpersonal skills",3
265,GENUINE PARTNER GROUP,Web Developer,"html, css, javascript, python, php, ruby, java, angular, c, wordpress",14
266,GETS - Global Energy Technical services Company limited,Mechanical Engineer,"english, communication, communication skills",3
267,GFT Technologies,APAC Digital Marketing Specialist,"digital, digital marketing, marketing, content marketing, strategies, lead generation, social media platforms, communication, marketing automation, performance metrics, seo, creative, communication skills, english, email marketing, website optimization, optimization, google analytics, interpersonal skills",42
268,GFT Technologies,Business Analyst,"digital, organizational, conflict resolution, english, communication, presentation, leadership",10
269,GFT Technologies,Country Human Resources Manager - Vietnam,"strategies, business strategy, hr manager, leadership, organizational, communication, team management, english",14
270,GFT Technologies,Engineering Manager,"strategies, organizational, java, sql, api, team building",10
271,GFT Technologies,Scrum Master,"problem solving, analytical skills, organizational, conflict resolution, negotiation skills, flexible, documentation, communication, dashboards, leadership, organized, time management, multitask, communication skills, english",20
272,GFT Technologies,Solution Architect,"problem solving, java, leadership, english",6
273,GMEELAN,Offline channel manager813,"strategies, market research, vietnamese, english",5
274,GMEELAN,Vietnam KOL Business Development Specialist0630,"vietnamese, english, communication",3
275,GMEELAN,Vietnam Recruitment Specialist807,"optimization, english, communication",3
276,"GMO Research & AI, Inc.",Web Designer,"digital, marketing, creative, ui, product design, communication, html, css, encryption, leadership, english",20
277,GREENFEED GROUP,Head of ERP,"leadership, optimization, dashboards, project management, itil, team management, communication, interpersonal skills",12
278,GREENFEED GROUP,Head of Technology and Operations,"strategies, incident response, data assets, leadership, strategic planning, digital, project management, stakeholder management, communication, interpersonal skills",14
279,Gaia Information Technology,Sales Business Development Manager,"business development, digital, aws, azure, leadership, api, communication, communication skills, interpersonal skills, client, english",18
280,Galaxy FinX,Chief Risk Officer (Vietnamese only),"digital, data driven, strategies, analytical skills, statistical analysis, leadership, team management, communication, communication skills",18
281,Galaxy FinX,Solutions Architect,"business development, api, java, nosql, communication, digital, ui, databases, kubernetes, azure",12
282,"Galaxy Studio., JSC",Chief Accountant,"vietnamese, leadership, communication, english, negotiation skills",7
283,"Galaxy Studio., JSC",Senior Human Resources Manager,"strategies, organizational, english, vietnamese, performance management, communication",6
284,"Galaxy Studio., JSC",Senior Marketing Executive,"marketing, strategies, vietnamese, advertising, creative, market research, communication, english, communication skills, presentation, project management, analytical skills, data analysis, google analytics",41
285,"Galaxy Studio., JSC",Senior Media Sales Executive,"presentation, marketing, english, ms word, ms excel, excel, powerpoint",7
286,"Galaxy Studio., JSC",Senior Sales & Marketing Manager,"marketing, strategies, digital, digital marketing, organizational, creative, creative thinking, data analysis, communication, communication skills, presentation, vietnamese, english, leadership, problem solving",29
287,Gamuda Land (Vietnam),Deputy Legal Manager,"documentation, vietnamese, communication, critical thinking",4
288,Gamuda Land (Vietnam),Senior Market Intelligence Executive,"marketing, market research, business development, time management, presentation",5
289,Gene Solutions,IT Manager (SEA),"r, vietnamese, leadership, presentation, communication, problem solving, english",8
290,Gene Solutions,Procurement specialist,flexible,1
291,Generali Vietnam Life Insurance,Legal Senior Manager/ Associate Director,"c, marketing, team management, flexible",4
292,Geniebook,Performance Marketing Specialist,"english, digital, digital marketing, marketing, seo, lead generation, optimization, strategies, advertising, communication, campaign management, communication skills",32
293,Genpact,Human Resources Operations Specialist - Relocation to KL,"go, digital, client, communication, dashboards, vietnamese, english",9
294,GiaoHangNhanh (GHN),Area Manager,"optimization, strategies, strategic thinking, analytical skills, data analysis, leadership, communication, communication skills",9
295,GiaoHangNhanh (GHN),Product Specialist,"strategies, software development, problem solving, ownership, communication, agile methodologies",6
296,GiaoHangNhanh (GHN),Senior Frontend Developer,"ui, flexible, api, ux, analytical skills, software development, react, js, javascript, css, problem solving, aws, web apps",18
297,GiaoHangNhanh (GHN),Senior Software Engineer,"api, java, server, nosql, communication, communication skills, react, big data, aws",11
298,GiaoHangNhanh (GHN),Senior/Lead Data Analyst,"data driven, dashboards, data visualization, organizational, communication, communication skills, sql, nosql, mongodb, python, excel, tableau, big data, spark",14
299,Givaudan,Account Executive (8 months contract),"business development, marketing, english",3
300,Global Sources,Assistant Account Manager,"market research, team management, strategies, communication, marketing, project management, business development, presentation, english, vietnamese",13
301,Global Sources,Marketing Executive,"marketing, email marketing, digital, digital marketing, content marketing, communication, interpersonal skills, english, organized",18
302,Globevisa Group,Senior Marketing Specialist,"marketing, client, creative, digital, digital marketing, campaign management, strategic planning, strategies, market research, content marketing, lead generation, communication, communication skills, project management, multitask, problem solving",45
303,GoNetZero™,"Commercial Lead, Renewable Energy Certificate Business (Vietnam)","data driven, adaptability, marketing, lead generation, communication, communication skills, english",7
304,Gojek,Partnership Senior Manager,"business development, growth strategy, optimization, people management, leadership, strategies, client, market research, marketing, data analysis, strategic planning, critical thinking, problem solving, communication, negotiation skills, stakeholder management, presentation",26
305,Golden Communication Group,Senior Copywriter,"vietnamese, flexible, excel, advertising, creative, client, presentation, influencer marketing, marketing, communication, time management, project management",18
306,Golden Communication Group,Senior Human Resources,"marketing, team building",2
307,Golden Communication Group,Senior Public Relations Specialist,"vietnamese, flexible, strategies, project management, client",8
308,Goldwind,Senior Business Development Manager,"marketing, communication, coordination skills, english",4
309,Google,"Account Manager, Agency, Large Customer Sales","advertising, consultative sales, business development, marketing, english, vietnamese, digital, digital marketing, creative, communication, communication skills, client, strategies",25
310,Google,"Associate Product Marketing Manager, Ads","vietnamese, marketing, problem solving, initiative, leadership, go, strategies, organizational",23
311,Google,"Phó quản lý tiếp thị sản phẩm, Google Ads","english, problem solving, communication, leadership, vietnamese, marketing, strategies, advertising",28
312,Grab,"Client Partner, GrabAds","advertising, client, strategies, marketing, business development, negotiation skills, communication",9
313,Grab,Principal Product Manager - Experimentation Platform,"organizational, user research, marketing, go, software development, problem solving, data driven, data engineering",8
314,Grab,"Senior Software Engineer, Fullstack","databases, ui, react, angular, aws, problem solving, analytical skills, english, communication, demand planning, team building, algorithms, communication, java, c",18
315,Grab,"Senior Software Engineer, Mobile (iOS)","r, go, c, algorithms, data structures, api, ui, communication, ownership",9
316,Grab,"Software Engineer, Mobile (iOS)","r, go, c, algorithms, data structures, api, ui, communication, ownership",9
317,GroupM,"Mindshare | Manager, Content+","client, digital, business development, marketing, advertising, communication, problem solving, vietnamese, english, ms office",15
318,GroupM,"Senior Director, Client Leadership","client, leadership, project management, multitask, digital, influencer marketing, marketing, client management, english, presentation, advertising",29
319,Groupe SEB,Head of Trade Marketing,"marketing, team work, leadership, communication, analytical skills",13
320,Gucci,HR Intern,"communication, communication skills, vietnamese, adaptability",4
321,HCLTech Vietnam,Analog Design Engineer (Very Atractice Salary),"digital, matlab, node, english, communication, protocols, flexible",8
322,HCLTech Vietnam,Cloud Security Engineer (ANZ Bank Project),"azure, aws, digital, client, api, software development, english, go, java, flexible",14
323,HCLTech Vietnam,DFT Engineer (Hanoi & HCMC),"english, flexible, digital, r, iot",8
324,HCLTech Vietnam,Physical Design Engineer (Global Projects),"digital, optimization, ownership, perl, flexible, english",7
325,HCLTech Vietnam,[HCL x ANZ] Security Consultant/Expert,"azure, aws, digital, client, firewalls, encryption, risk analysis, strategies, software development, english, communication, problem solving, kubernetes, go, java, flexible",20
