,Company/Candidate Name,Role,Sub-skill,Count
641,PropertyGuru Group,Sales Operations Specialist,"dashboards, english, business analysis",3
642,Publicis Groupe,(Senior) Digital Planner,"marketing, strategies, digital, digital marketing, optimization, strategic thinking, adwords, organized, google analytics, presentation, communication, english",16
643,Publicis Groupe,Constellation | Associate Digital Manager,"marketing, strategies, digital, digital marketing, optimization, advertising, adwords, organized, presentation, communication, english, critical thinking, problem solving, ms excel, excel",18
644,Publicis Groupe,Constellation| Social Account Executive,"go, client, strategies, marketing, vietnamese, communication, interpersonal skills, creative",10
645,Publicis Groupe,Media Executive,"marketing, digital, campaign management, creative, client, english",9
646,Publicis Groupe,Media Planner,"client, advertising, statistics, creative, marketing, market research, presentation, communication, time management",13
647,Publicis Groupe Vietnam,Commercial Finance Supervisor - 7-month contract,"client, strategies, financial analysis, creative, dashboards, leadership, data analysis, multitask, english, problem solving, organizational, advanced excel, excel, data visualization",21
648,Publicis Groupe Vietnam,Constellation | Digital Executive,"client, digital, organized, google analytics, presentation, communication, english",9
649,Publicis Groupe Vietnam,Constellation| Senior Copywriter,"go, creative, creative thinking, client, ux, interpersonal skills, digital, advertising",27
650,Publicis Groupe Vietnam,Digital Manager,"digital, data driven, client, marketing, strategies, digital marketing, optimization, advertising, adwords, organized, presentation, communication, english, critical thinking, problem solving, ms excel, excel",21
651,Publicis Groupe Vietnam,Digital Trainee,"client, marketing, advertising, communication, excel, powerpoint",8
652,Publicis Groupe Vietnam,Digitas | Senior Ecommerce Executive (Health and Beauty),"marketing, client, strategies, team work, optimization, flexible, interpersonal skills, web analytics, web analytics tools, google analytics, tableau, problem solving, presentation, leadership, digital",30
653,Publicis Groupe Vietnam,Digitas | Technical Project Manager,"marketing, digital, project management, optimization, problem solving, presentation, vietnamese, english",16
654,Publicis Groupe Vietnam,Leo Burnett | Community – Senior Social Executive (Social Outreach focused),"go, optimization, client, digital, social media marketing, marketing, social media platforms, writing skills, communication, creative, ownership",15
655,Publicis Groupe Vietnam,Leo Burnett | Senior Account Executive,"go, creative, digital, advertising, marketing, documentation, organized, communication, english",15
656,Publicis Groupe Vietnam,Leo Burnett | Social Outreach Associate Manager,"go, optimization, client, people management, digital, social media marketing, marketing, social media platforms, writing skills, communication, creative, ownership",16
657,Publicis Groupe Vietnam,MSL | Senior Copywriter,"creative, creative thinking, english, client, critical thinking, digital, vietnamese, interpersonal skills, advertising",14
658,Publicis Groupe Vietnam,Media Planning Lead,"marketing, communication, digital, creative, strategies, project management, ownership, go, english, marketing, communication, digital, creative, strategies, project management, ownership, go, english",30
659,Publicis Groupe Vietnam,"Media Planning, Associate Manager","marketing, communication, digital, creative, strategies, project management, ownership, go, english",15
660,Publicis Groupe Vietnam,Publicis | Senior Account Executive,"atl, digital, creative, marketing, advertising, documentation, english",17
661,Publicis Groupe Vietnam,Senior Digital Marketing Executive - Ecommerce,"digital, optimization, client, english",6
662,Publicis Groupe Vietnam,Senior Digital Planner,"optimization, client, strategic thinking, strategies, digital, adwords, organized, google analytics, english, presentation",13
663,Publicis Groupe Vietnam,Senior Performance Manager,"marketing, communication, digital, creative, ownership, data driven, strategies, optimization, client, go, marketing, communication, digital, creative, ownership, data driven, strategies, optimization, client, go",36
664,Publicis Groupe Vietnam,Senior Planning Manager,"marketing, communication, digital, creative, strategies, project management, ownership, go, english",15
665,QIMA,Business Development Manager,"client, business development, communication, communication skills, supply chain, digital, product testing, english, vietnamese",11
666,QIMA,Business Development Manager (Lab-testing service),"client, business development, communication, communication skills, supply chain, digital, product testing, english, vietnamese",11
667,RMIT University,Accounting Teacher,"english, communication",4
668,RMIT University,"Associate Professor, Finance","digital, leadership, communication, english",7
669,RMIT University,Change Manager (Procurement Champion Project - 12 months & contracted via 3rd party),"communication, strategies, leadership, organizational, ownership, negotiation skills, initiative, problem solving, customer focused, customer focused, communication skills, english, vietnamese",19
670,RMIT University,Gendered Harm Advisor,"english, communication",5
671,RMIT University,"Lecturer, Finance","digital, english, communication",3
672,RMIT University,"Lecturer, Human Resources Management","digital, english, communication",3
673,RMIT University,Legal Manager,"project management, documentation, communication, time management, creative, flexible, vietnamese, english",11
674,RMIT University,"Manager, Equitable Learning and Accessibility","organizational, english, communication",6
675,RMIT University,Program Manager,"business analysis, leadership, project management, communication, negotiation skills, agile methodologies, vietnamese, english",10
676,RMIT University,"SGS - Senior Lecturer in Advertising, Professional Communication","leadership, advertising, creative, digital, marketing, digital marketing, english, communication",20
677,RMIT University,Security Manager,"leadership, access control, client, communication, communication skills, english, vietnamese, problem solving",13
678,RMIT University,"Senior Lecturer, Human Resources Management","digital, english, communication",3
679,RMIT University,"Senior Lecturer, Psychology","english, writing skills, communication",8
680,RMIT University,"Senior Lecturer/Lecturer, International Business","digital, strategic planning, communication, communication skills, english",7
681,RMIT University,"Senior Manager, Compensation, Benefits and HR Services","vietnamese, organizational, leadership, team management, communication, interpersonal skills, english",12
682,RMIT University,"Senior Manager, Digital Innovation and Library Systems","digital, leadership, communication, project management, analytical skills, problem solving, strategic thinking, stakeholder management, vietnamese, english",22
683,RMIT University,Technical Delivery Lead,"client, leadership, project management, powerbi, problem solving, itil, communication, interpersonal skills, negotiation skills, organizational, time management, english",19
684,RRecruiter,Recruitment Consultant (Intern/Fresh/No Experience Required),"client, english",2
685,RRecruiter,Recruitment Consultant/ Talent Acquision Specialist (Fresher/No Experience Required),"client, social media platforms, english",3
686,Renesas Electronics,Atlassian Tools administrator ( JIRA/Confluence/Bitbucket),"documentation, english",2
687,Renesas Electronics,Marketing Recruitment Manager,"marketing, leadership, data driven, digital, client, problem solving, project management, communication, communication skills, interpersonal skills",13
688,Rhenus Logistics,Country Product Manager - Airfreight,"supply chain, strategic planning, strategies, leadership, digital, performance metrics, people management, communication, industry knowledge, negotiation skills, analytical skills, data driven, communication skills, financial analysis, problem solving, creative",24
689,Rieckermann,SharePoint Developer,"azure, api, java, c, initiative, english",6
690,Robert Walters,Digital Transformation Director,"digital, strategies, communication, documentation, leadership, organizational, project management, multitask, english, client",25
691,Royal De Heus,"Head of Purchasing, Asia","growth strategy, strategies, english, ms office, ms excel, excel, analytical skills, flexible",8
692,Royal HaskoningDHV,Business Development Intern,"business development, organizational, communication, communication skills, organized, marketing, c, brand management, english, ms word, powerpoint, team building",16
693,SAP,SAP Labs Vietnam - Employee and Ecosystem Manager,"r, leadership, creative, communication, vietnamese, english, presentation, resource planning, flexible",13
694,SAP,SAP Labs Vietnam - Operations Manager,"r, team leader, leadership, creative, communication, vietnamese, english, presentation, resource planning, flexible",14
695,SAP,SAP Labs Vietnam - Senior Operations Specialist,"r, project management, creative, communication, vietnamese, english, presentation, leadership, resource planning, flexible",13
696,SAP,SAP Labs Vietnam Operations - Program Manager,"r, leadership, creative, communication, vietnamese, english, presentation, resource planning, flexible",12
697,SCC Vietnam,Salesforce Developer,"software development, english",3
698,SID Global Solutions,Enterprise Sales Executive,"customer focused, customer focused, documentation, project management",5
699,SMG Swiss Marketplace Group,Mid/Senior iOS Engineer - 100% (w/m/d) - Ho Chi Minh City - Hybrid Work,"digital, performance metrics, english, communication, swift, ownership, problem solving, creative",11
700,SP Group,Business Development Manager,"business development, optimization, performance metrics, client, strategies, financial analysis, interpersonal skills, excel, powerpoint, business development, project management, english, communication",21
701,SPCT-Saigon Premier Container Terminal,Commercial Manager,supply chain,4
702,SPD Scientific,Business Development Manager (Industrial),"business development, strategies, marketing, business plan, leadership, market research, r, communication, presentation",14
703,SPS,Senior IT Business Analsyt,"communication, problem solving, documentation, business analysis, analytical skills, software development",9
704,SPS,Software Tester / SQC Engineer,"software development, api, team leader, communication, communication skills, digital, client, go, creative",10
705,Saigon Centre Shopping Mall,"Senior Executive, Retail Leasing","marketing, excel, english, vietnamese",4
706,Saint-Gobain Vietnam,Financial Services Manager,"vietnamese, leadership, people management, communication, presentation, english, ownership, flexible",12
707,Salt,Security Architect - Vietnam [Cyber Defense/IAM],"communication, communication skills, software development, incident response, network security",5
708,Sam's Club,Senior Quality Engineer - Furniture,"communication, problem solving, communication skills, english",5
709,Schneider Electric,Digital Transformation Intern,"digital, sql, c, asp, php, html, css, js, server, digital, sql, c, asp, php, html, css, js, server",20
710,Schneider Electric,General accountant (General Ledger) ( 9 months contract),"excel, english",2
711,Schneider Electric,Tax Specialist (9 months Contract),"documentation, english, process oriented, organized",5
712,Second Talent,Business Development Specialist,"business development, client, supply chain, strategies, communication, interpersonal skills",11
713,Serdao | Digital Services & 24/7 IT Support,Senior PHP Developer,"php, communication, english",6
714,SharkNinja,Senior HR & Admin Specialist,"hr manager, performance management, documentation, communication, communication skills, english",11
715,SharkNinja,Senior Manager – EHS / REGULATORY COMPLIANCE,"supply chain, leadership, protocols, english, excel, communication, team work",8
716,SharkNinja,"Sr Director, Supplier Network Development","supply chain, strategies, ownership, project management, optimization, analytical skills, problem solving, leadership, resource planning",26
717,SharkNinja,Test Engineer,"english, communication, communication skills",5
718,Sheraton Hotels & Resorts,Assistant Digital Marketing Manager,"strategies, marketing, advertising, digital, digital marketing, seo, creative, communication, communication skills, english",28
719,Sheraton Hotels & Resorts,Senior Recruiter,leadership,1
720,Shinhan Bank Vietnam,Compliance Specialist,"c, english, excel, communication, interpersonal skills",5
721,Shinhan Bank Vietnam,Corporate Relationship Manager,"financial analysis, documentation, organized, communication, communication skills, risk analysis, time management",8
722,Shopee,"Business Intelligence Analyst - Finance, Shopee","communication, sql, python, project management, ownership",6
723,Shopee,"Junior Category Manager (Electronics) - Business Development, Shopee","data analysis, business development, leadership, communication, problem solving",6
724,Shopee,Merchant Operations - ShopeeFood,"market research, strategies, critical thinking, communication, presentation, interpersonal skills, communication skills, english, flexible, time management, organizational",12
725,Shopee,Senior Business Development Lead - SPX Express (HCM/HN),"strategies, supply chain, business development, communication, presentation, negotiation skills, organizational, leadership",8
726,Shopee,Senior Finance Planning & Analysis - SPX Express,"business insights, demand planning, dashboards, optimization",7
727,Shopee,Senior Project Workforce Management - SPX Express,"performance metrics, data analysis, presentation, communication, communication skills, vietnamese, english, problem solving, critical thinking",9
728,Shopee,"Senior, Strategy Growth (PMO)","data driven, problem solving, critical thinking, project management, stakeholder management",5
729,Shopee,Workforce Acquisition Team Leader (Recruitment) - SPX Express,"creative, team management, communication, communication skills, problem solving",7
730,ShopeePay,"Senior Growth, Marketplace","marketing, optimization, business intelligence, project management, data driven, dashboards, excel, communication, communication skills, critical thinking, multitask",11
731,Siemens Gamesa,Commercial Project Manager,"project management, flexible, digital",5
732,Signify,Area Sales Manager - Central Region,"creative, leadership, strategic planning, strategies, business development, communication, presentation, problem solving",9
733,Sika,HRBP Specialist - Frontline,"performance management, marketing, leadership, strategies, conflict resolution, team building, communication, communication skills, analytical skills, data driven, problem solving, presentation, english, vietnamese",16
734,Sika,Management Trainee (Key Project Management),"strategies, leadership, problem solving, interpersonal skills, communication, people management, project management, market research, protocols, english, excel, powerpoint, ms office, adaptability",24
735,Sika,Marketing Design Intern,"marketing, flexible, creative",10
736,Simpson Strong-Tie,Senior .NET Developer,"customer focused, customer focused, organizational, creative, creative thinking, people focused, c, asp, r, api, sql, server, azure, aws, protocols, docker, devops, problem solving, analytical skills, communication, english, software development, leadership, team building, team work",29
737,Simpson Strong-Tie,Senior Business Analyst,"customer focused, customer focused, organizational, creative, creative thinking, people focused, optimization, strategies, documentation, english, communication, ui, ux, presentation, software development, leadership, team building, team work",19
738,Simpson Strong-Tie,Senior Software Developer,"customer focused, customer focused, organizational, creative, creative thinking, people focused, java, problem solving, r, software development, english, communication, api, mongodb, communication skills, leadership, team building, team work",23
739,Simpson Strong-Tie,Structural Engineer - R&D (Open for Fresher),"customer focused, customer focused, organizational, creative, creative thinking, people focused, r, vba, excel, problem solving, initiative, marketing, english, leadership, team building, team work",17
740,Simpson Strong-Tie Vietnam,IT Support Analyst,"documentation, access control, communication, english, software development, leadership, team building, team work",9
741,Simpson Strong-Tie Vietnam,Scrum Master Lead,"team leader, problem solving, leadership, organizational, time management, communication, stakeholder management, english, presentation, initiative, team management, people management, software development, team building, team work",19
742,Simpson Strong-Tie Vietnam,Senior IT Business Analyst - Building Technology,"creative, creative thinking, people focused, optimization, strategies, english, communication, ui, presentation, software development, leadership, team building, team work",15
743,Simpson Strong-Tie Vietnam,Senior Office Operations,"creative, creative thinking, people focused, communication, english, initiative, team building, team work",11
744,Simpson Strong-Tie Vietnam,Senior Scrum Master - Building Technology,"leadership, conflict resolution, english, writing skills, presentation, software development, team building, team work",13
745,Simpson Strong-Tie Vietnam,Senior SharePoint Developer,"azure, marketing, react, javascript, html, json, sql, software development, communication, leadership, english, team building, team work",17
746,Simpson Strong-Tie Vietnam,Structural Engineer (R&D) - Open for Fresher,"r, product design, vba, excel, problem solving, initiative, marketing, english, team building",13
747,Sky Mavis,Graphic Designer,"communication, marketing, creative, english, digital, ownership",8
748,Sky Mavis,HR Ops Specialist (Open for International candidate),"communication, problem solving, excel, powerpoint, ownership",6
749,SoftwareOne,Cloud Services Consultant (L2 Consultant),"azure, problem solving, communication, devops",21
750,SoftwareOne,Delivery Consultant - Cloud,"aws, client, kubernetes, server, protocols, ansible, docker, python, devops, problem solving, communication, communication skills, vietnamese, english",24
751,SoftwareOne,Project Manager,"documentation, strategies, conflict resolution, presentation, organizational, organized, strategic thinking, project management, leadership, client, communication, communication skills, english, problem solving, azure, digital",23
752,SoftwareOne,Security Consultant,"identity management, client, azure, documentation, incident response, risk analysis, protocols, firewalls, problem solving, communication, communication skills",20
753,SoftwareOne,Senior Cloud Services Consultant (L3 Consultant),"organizational, strategies, azure, network security, leadership, documentation, communication, presentation, problem solving, stakeholder management, devops",21
754,Solar Turbines,Fleet Engineer (Gas Turbine),"optimization, interpersonal skills",2
755,Solventum,"Senior Legal Counsel, Vietnam","strategies, organizational, vietnamese, english",4
756,Sony Music Entertainment,Social Media Content Executive,"digital, social media platforms, optimization, seo, increase brand awareness, strategies, content marketing, marketing, creative, data driven, digital marketing, advertising, communication, presentation, vietnamese, english",34
757,Stanley 1913,"Technical Developer, Soft Goods - HoChiMinh City","optimization, communication, communication skills",3
758,Starbucks Vietnam,District Manager,"leadership, organizational, marketing, team building, performance management, creative, interpersonal skills, problem solving",14
759,Sucafina,Logistics Execution Coordinator,client,1
760,Sun Life,IT Project Manager (Scrum Master),"project management, client, resource planning, software development, sdlc, organizational, communication, communication skills, problem solving, java",14
761,Sun Life,Senior Manager Infrastructure,"aws, leadership, digital, optimization, business strategy, stakeholder management, communication, creative, resource planning, problem solving, organizational, time management, ownership, client, react, english",28
762,Sunbytes,Recruitment Consultant,"software development, client, strategies, communication, interpersonal skills, social media platforms, organizational, time management, creative",9
763,Suntory Global Spirits,Brand Specialist,"strategies, marketing, creative, brand management, digital, digital marketing, organizational, communication, communication skills",15
764,Suntory Global Spirits,"Senior Marketing Manager SEA, TH & VN","marketing, strategies, strategic planning, advertising, communication, digital, creative, optimization, atl, btl, communication skills",26
765,Suntory PepsiCo Vietnam Beverage,Assistant Brand Manager - 7Up (FMCG/ MNCs Experience is a must),"marketing, communication, communication strategy, market research, project management, data analysis, flexible",13
766,Suntory PepsiCo Vietnam Beverage,New Product Commercialization Manager,"documentation, r, supply chain, problem solving, leadership, communication, english, project management",9
767,Suntory PepsiCo Vietnam Beverage,Senior Finance Business Partner - Marketing,"marketing, strategic thinking, communication, communication skills, performance management, c, leadership, english, ms excel, excel",18
768,Suntory PepsiCo Vietnam Beverage,Senior HR Manager - Business Parner - Sales (Non-TT),"c, leadership, performance management, organizational, communication, business plan, communication skills, interpersonal skills, stakeholder management",18
769,Suntory PepsiCo Vietnam Beverage,Senior Project Manager (Line Expansion/ Productivity/ New Product Development),"project management, communication, documentation, c, optimization, english",9
770,Swisslog,Sales Executive,"flexible, data driven, supply chain, team leader, negotiation skills, presentation, communication, communication skills, english",10
771,TAM SON INTERNATIONAL JSC,Fashion Trainer,"presentation, performance management, communication, english, excel, powerpoint, communication skills, problem solving, time management, creative",12
772,TDCX,Customer Experience Specialist - Hospitality Account (Relocation Malaysia).,"client, communication, communication skills, english, interpersonal skills, project management",7
773,TDCX,Front End Developer - (TAG - VN),"advertising, digital, digital marketing, marketing, javascript, css, js, client, communication, communication skills, english, vietnamese, wordpress, adwords, html",26
774,TUYỂN DỤNG CITIGYM,Trưởng nhóm Phát triển Phần mềm/Ứng dụng,"optimization, web apps, communication, problem solving",5
775,Takeda,General Accountant,"communication, communication skills, ms office, powerpoint, english",6
776,Takeda,HR Business Partner,"organizational, strategic planning, performance management, leadership, statistics, communication, communication skills, initiative, go, vietnamese, english",13
777,Talent Job Seeker,.NET Developer - Dynamics 365 Specialist,"software development, sql, server, c, problem solving, communication",8
778,Talent Job Seeker,Head of Mobile Security Research and Operations,"leadership, r, agile methodologies, creative, problem solving, communication, communication skills, vietnamese",9
779,Talent Job Seeker,Key Account Manager,"client, project management, business development, communication, negotiation skills, english",11
780,Talentnet Corporation,Head of Industrial Real Estate,"client, documentation, marketing, english, business development",5
781,Talentnet Corporation,International Sales Manager,"vietnamese, organized, excel, powerpoint, process oriented, english",6
782,Talentnet Corporation,Senior Partnership Distribution Officer (preferred Wealth Advisor/Broker),"digital, business development, client, marketing, market research, communication, english, vietnamese",9
783,Tech Data APAC​,Business Development Manager,"business development, inventory management, english, organizational, time management, leadership",10
784,Tech Data APAC​,Senior Pre-sales Consultant,"presentation, marketing, strategies, communication, english, problem solving, leadership, presentation, firewalls, network security, flexible, leadership",15
785,Techcombank (TCB),(Senior) Security Architect,"initiative, incident response, strategies, firewalls, english",6
786,Techcombank (TCB),Chuyên Viên Cao Cấp Thẩm Định Tín Dụng Doanh Nghiệp,english,1
787,Techcombank (TCB),"Expert, HR Business Partner","strategies, business development, organizational, communication, leadership, people management, english",11
788,Techcombank (TCB),"Senior Expert, Learning Partner","leadership, business strategy, english",3
789,Techcombank (TCB),"Senior Expert, Private Client Relationship Management","client, marketing, organizational, business plan, english, direct sales, sales management",13
790,Techcombank (TCB),"Senior Manager, Solution Architecture","business development, project management, performance management, software development, java, iot, strategies, digital, english",10
791,Techcombank (TCB),Talent Acquisition Officer (Mass Recruitment),"creative, digital, initiative, english, vietnamese",5
792,Techtronic Industries - TTI,New Product Development (NPD) Engineer,"documentation, communication, english, problem solving",5
